Gender;Age;Condition;Preferences_human_versus_robotic_replacement;Attention_check;Qualitative_question;Education;Occupation;Income
2;18;1;2;2;i can learn what the other can do why i have to leave. A robot is always more efficient then me. ;3;10;1
2;18;1;1;3;If the quality and costs of replenishment are the same, then it is better to hire new employee as it is always better to have contact with a person than with robot. There is no way robots or machines can replace people's mind.;2;10;1
1;19;1;1;2;Being replaced, in the first place, does not awake good emotions with me. However, if there is no other way I prefer being replaced by a person, not a robot. At least some one else will get a chance to work and help his/her family. Also being replaced by the robot causes personal discomfort. ;2;10;1
2;18;1;1;2;I dont think being replaced by a robot is fair. A robot can probably work way faster and better.  If another employee takes over my job i will feel less screwed.;2;1;1
1;19;1;2;2;I would like to be replaced by a robot, because then i have got the feeling that Im good at the job, but technology beats me. When another employee replaces me, I get the feeling that im bad at my job.;3;4;1
2;22;1;2;2;If I would be replaced by another employee, I would feel rejected, thus I would rather have a robot replacing me.;3;10;1
1;18;1;2;2;I would think that a robot is more effective and works more efficiently than a person. Therefore, I would understand my replacement by a robot. Whereas, if I was a good worker and would be replaced by another employee, I wouldn't really understand this. Because the company would be unsure of the performance of the new employee and maybe I would be better at the job than the new employee.;3;10;1
2;18;1;1;2;I feel that a robot would make the job boring for other employees because they cannot socialise with is. Another employee would be better because it is fun to get to know other persons, even though it is not you meeting this person.;2;4;1
2;19;1;2;2;With the person, there's someone with a new job, this is positive. But this person is also better than me (they think).  With the robot, the company has a good reason to replace me, because it's cheaper I think.;3;10;1
2;18;1;2;2;If a robot replaces me I wouldnt care as much as when a person replaces me because I would think it is unfair for me.;2;10;1
2;18;1;2;2;if a human replaces me it means that someone is better. if a robot replaces me it's not a human he can do things that i can not. ;2;10;1
2;18;1;2;1;If i would get replaced because my company thinks i'm not working well, it would be way more worse if a robot would replace me because robots are way more efficient. And I would not like it when a human being would replace me because eventually we are the same and they would think he or she is better in doing the job;2;4;1
1;20;1;2;2;because I think that I will be able to get a new job, and the firm will compensate me for  volunteering , I believe in myself in my competences so i think i stand a better chance than my colleague in finding a new job;2;10;1
2;24;1;1;2;Well in first place it didn't really matter to me. But in the end I thought maybe someone needs the money too. So I chose for the employee for he or she maybe has a family they need to provide. A robot is maybe more productive but i'd rather give another human being a chance.;4;1;1
2;18;1;2;2;Maybe it is sort of jealousy. You are jealous of the other employee who have the chance to work instead of you.;2;4;1
1;18;1;2;2;it feels as kind of failure when you are replaced by another employee, while being replaced by a robot feels as being replaced by technology, which is more understandable.;3;10;1
2;21;1;1;2;the robot techonic is not mature;3;7;3
1;18;1;2;2;Some competitive feelings. A human could be better than me. because of their experience, education and such. However a robot has abilities what no human could have. So if a robot replaces me, I would not have bitter feelings, because does things which are humanly impossible.;2;4;1
1;18;1;2;2;a new employee is comparable to me, so if I would be replaced by someone else I would feel like the other person is better. Otherwise, why would they replace me? It's not possible compare a human being to a robot, so if that would happen I would blame myself less.;3;1;1
2;18;1;2;2;i think robots can be made more capable than humans. so robots can do more things than humans.   If i would be replaced by a robot i think i could accept that because robots are better. (in my opinion)    if i would be replaced by a human, i would began to doubt about myself and my capabilities. i would not feel happy, because i would really feel replaced because i wasn't good enough.;2;4;1
2;19;1;2;2;Robots cant's say that they are sick or so, so that's why i prefer the robots above new employees.;6;10;1
2;20;1;2;2;Als je vervangen wordt door een andere medewerker voel je jezelf nutteloos omdat iemand dus hetzelfde kan voor minder geld. Door een robot is minder erg omdat het technologische vooruitgang is.;2;10;1
1;19;1;1;2;As there is no difference in the quality or productivity level, I would prefer a person replacing me rather than a robot. This because the person replacing me was unemployed and I would like to give him a sense of financial independency and all the other emotions and benefits associated with working. Also if we both are unemployment, the unemployment rate goes up and that is not good. ;4;4;1
1;19;1;2;1;Die andere werknemer zou dan beter zijn dan ik, terwijl ik daar al een hele tijd werk. Een robot zou het ook op een andere manier doen dus dat zou ik minder erg vinden.;3;4;1
1;17;1;2;3;In the case I would be replaced by a robot I would have more understanding towards the replacement, since robots can be more productive than human beings. This would not make me feel bad about myself or my performance.  Whenever I would be replaced by another/new employee I assume that I am not doing my work/job as well as my replacement. This would make me feel bad about myself since I am not good enough for the company/the work.;2;4;1
2;19;1;1;2;Nowadays more company's are replacing work that used to be done by humans and I don't like this, because people still need to earn money to life from ;2;4;1
2;20;1;2;2;Losing from one other human, feels more as failure than losing from a mechanism that has been developed by hundreds if not even thousands humans (scientists). It might sound a little bit far-fetched but for example I would not care losing a running game versus a cheeta as this animal is totally different endowed  compared to me. However, I could be disappointed if I lost a game running against a classmate of mine. It is not a shame losing of something/somebdoy that has in the beginning better advantages/posibilities than you to win, as it is losing from somebody/something that has more or less equal capabilities. It is in the last case more confronting, it basically feels more like that it is your own fault that you lost, not because of the situation or opponent;2;10;1
2;24;1;2;2;It's the future, wherein robots take over our jobs. So in that case the same economic output is delivered, but people don't have to work anymore to deliver that output. In an utopia that could mean that the people generally don't have to work anymore, but still earn a living, and have all the free time to do whatever they want. However, if replaced by another employee, that's not really helping the development. ;2;10;1